{
  "slice_id": "slice-008",
  "verdict": "approved",
  "timestamp": "2026-04-14T10:14:45.7218479-04:00",
  "quality_checks": [
    {
      "category": "duplication",
      "status": "pass",
      "evidence": "A separacao entre GET Livewire e POST controller no diff evita duplicacao funcional relevante; os ACs de settings ficam atendidos por um caminho de visualizacao e um de persistencia."
    },
    {
      "category": "complexity",
      "status": "pass",
      "evidence": "A transacao em TenantSettingsUpdater centraliza tenant, empresa raiz e filial raiz em um unico ponto e preserva AC-012 sem espalhar regra de negocio."
    },
    {
      "category": "naming",
      "status": "pass",
      "evidence": "Os nomes novos seguem o dominio do slice: TenantSettingsController, CurrentTenantResolver, TenantSettingsUpdater, companies, branches e tenant_audit_logs."
    },
    {
      "category": "security",
      "status": "pass",
      "evidence": "O diff aplica resolucao de tenant autenticado, RLS por tenant_id, validacao de CNPJ e auditoria sem segredos, alinhando AC-SEC-001 a AC-SEC-003."
    },
    {
      "category": "simplicity",
      "status": "pass",
      "evidence": "O fluxo ficou direto: a tela renderiza o formulario e o submit segue para POST /settings/tenant com validacao e persistencia atomica."
    },
    {
      "category": "glossary",
      "status": "pass",
      "evidence": "A implementacao usa os termos canonicos do slice e do glossario: tenant, empresa raiz, filial raiz, gerente, modo somente leitura e laboratorio."
    },
    {
      "category": "adr_compliance",
      "status": "pass",
      "evidence": "O diff segue ADR-0001, ADR-0004 e ADR-0010 com Laravel/Livewire/PostgreSQL, Fortify/Sanctum e o threshold R6 esperado."
    },
    {
      "category": "dead_code",
      "status": "pass",
      "evidence": "Nao ha trecho estruturalmente morto evidente no pacote permitido que comprometa o slice; os pontos de leitura e escrita estao conectados ao fluxo da rota."
    }
  ],
  "findings": [],
  "next_action": "approve_pr"
}
