{
  "slice_id": "slice-011",
  "verdict": "approved",
  "timestamp": "2026-04-15T21:30:00Z",
  "quality_checks": [
    {
      "category": "duplication",
      "status": "pass",
      "evidence": "Dataset SqlInjectionPayloads.php compartilhado via require entre TenantIsolationHttpTest e TenantIsolationSecurityTest — design correto, não copy-paste. Padrão initializeTenant/endTenant centralizado em TenantIsolationTestCase. Nenhum bloco >10 linhas duplicado entre arquivos."
    },
    {
      "category": "complexity",
      "status": "pass",
      "evidence": "Função mais complexa é TenantIsolationModelTest AC-001 com switch de 4 branches — cada branch <10 linhas, nesting máximo 3 níveis. TenantIsolationJobTest AC-012 com introspecção de middleware: ~30 linhas, linear. Todas as funções abaixo de 50 linhas."
    },
    {
      "category": "naming",
      "status": "pass",
      "evidence": "Nomes descritivos e consistentes: firstSensitiveTable, getSensitiveTables, ensureExportFixture, collectTenantBLiterals, initializeTenant, endTenant, createSharedFixture. Convenção verbo+substantivo respeitada. Sem abreviações obscuras."
    },
    {
      "category": "security",
      "status": "pass",
      "evidence": "Rota /api/tenant-context guarded por app()->environment('local','testing') — não exposta em produção. Expõe apenas tenant_id (não PII). LogTenantContextOn4xx loga apenas tenant_id, status e path — sem dados sensíveis. Nenhum secret hardcoded. Queries via ORM/QueryBuilder com bindings parametrizados — sem concatenação de SQL."
    },
    {
      "category": "simplicity",
      "status": "pass",
      "evidence": "TenantContext é holder estático mínimo (3 métodos) com justificativa clara (queue workers sem Request). JobTenancyBootstrapper segue pattern save/restore com finally. Sem abstrações prematuras. ProcessConsentJob stub intencional com comentário explicativo — referenciado em config e testes."
    },
    {
      "category": "glossary",
      "status": "pass",
      "evidence": "Termos canônicos usados: Tenant, ConsentSubject, ConsentRecord, LgpdCategory, TenantUser, LoginAuditLog, TenantAuditLog, Branch, Company. Nenhum alias proibido (WorkOrder, Ticket, Organização etc) identificado no diff."
    },
    {
      "category": "adr_compliance",
      "status": "pass",
      "evidence": "ADR-0001 (Laravel 13 + stancl/tenancy single-database + Pest 4): stack respeitada integralmente. ADR-0004 (identidade/autenticação): middleware de contexto de tenant preserva modelo de autenticação. ADR-0014 (bypass policy): nenhum bypass de gate. Alterações de model nos agents (sonnet→opus) são configuração operacional, não violação de ADR."
    },
    {
      "category": "dead_code",
      "status": "pass",
      "evidence": "Todos os imports usados verificados. ProcessConsentJob::handle() vazio é stub intencional (fixture de teste), com comentário e referência ativa em config/tenancy-jobs.php e TenantIsolationJobTest. Nenhuma função órfã ou código não-alcançável identificado."
    }
  ],
  "findings": [],
  "next_action": "approve_pr"
}
