{
  "slice_id": "slice-003",
  "verdict": "approved",
  "timestamp": "2026-04-12T21:00:00Z",
  "quality_checks": [
    {
      "category": "duplication",
      "status": "pass",
      "evidence": "CiTriggerTest usa dataset Pest para AC-001/002/003 (sem repetição de asserts). CiRuntimeTest extrai lógica repetida em runToolOnTempFile. Padrão base_path+file_exists+file_get_contents em CiJobsTest/CiSbomTest repete ~3 linhas por teste, abaixo do threshold de 10 linhas."
    },
    {
      "category": "complexity",
      "status": "pass",
      "evidence": "runToolOnTempFile (CiRuntimeTest.php:613-630) tem responsabilidade única, fluxo linear, sem nesting. CiRuntimeTest.php com 113 linhas contém 4 testes independentes sem lógica compartilhada complexa. Nenhuma função ultrapassa 50 linhas ou 3 níveis de nesting."
    },
    {
      "category": "naming",
      "status": "pass",
      "evidence": "Funções e variáveis descritivas: runToolOnTempFile, $hasSilentFallback, $coversAllBranches, $hasHarnessDep, $missingJobs, $installLineWithSilentFallback. Classes nomeadas por responsabilidade: CiJobsTest, CiTriggerTest, CiSbomTest, CiRuntimeTest."
    },
    {
      "category": "security",
      "status": "pass",
      "evidence": "runToolOnTempFile usa escapeshellarg corretamente (CiRuntimeTest.php:623). Badge no README usa URL pública do GitHub Actions, sem tokens. Sem secrets hardcoded. Sem SQL/XSS. ci.yml não escreve credenciais em outputs."
    },
    {
      "category": "simplicity",
      "status": "pass",
      "evidence": "Cada arquivo de teste tem escopo único por AC. rector.php usa API fluente nativa do Rector. ci.yml adiciona job php-rector com estrutura idêntica aos demais jobs PHP (consistência). Sem abstrações prematuras ou dependências desnecessárias."
    },
    {
      "category": "glossary",
      "status": "pass",
      "evidence": "Slice de infraestrutura CI — sem termos de domínio metrológico. Nenhum alias proibido do glossary-domain.md foi utilizado."
    },
    {
      "category": "adr_compliance",
      "status": "pass",
      "evidence": "ADR-0001 (stack PHP/Laravel): respeitado. ADR-0002 (MCP policy): não afetado. Decisões D1 (Rector --dry-run), D2 (CycloneDX sem || true), D3 (push branches:**), D4 (paralelo a harness), D5 (cache compartilhado) documentadas em plan.md sem contradizer ADRs existentes."
    },
    {
      "category": "dead_code",
      "status": "pass",
      "evidence": "Sem imports não usados (arquivos PHP usam declare strict_types sem use statements desnecessários). Placeholder {DIR} em runToolOnTempFile é usado pelo teste AC-001 do Pint (CiRuntimeTest.php:635-636). Sem funções órfãs."
    }
  ],
  "findings": [],
  "next_action": "approve_pr"
}
