{
  "slice_id": "slice-001",
  "verdict": "approved",
  "timestamp": "2026-04-12T08:20:00Z",
  "quality_checks": [
    {
      "category": "duplication",
      "status": "pass",
      "evidence": "Scaffold gerado por composer create-project, sem duplicacao introduzida"
    },
    {
      "category": "complexity",
      "status": "pass",
      "evidence": "Zero logica customizada — apenas scaffold e configuracao de ferramentas"
    },
    {
      "category": "naming",
      "status": "pass",
      "evidence": "Nomes seguem convencoes Laravel (app/, config/, routes/) e plan.md (Domain/, Infrastructure/)"
    },
    {
      "category": "security",
      "status": "pass",
      "evidence": ".env.example nao contem segredos reais; .gitignore exclui .env; composer audit limpo"
    },
    {
      "category": "simplicity",
      "status": "pass",
      "evidence": "Minimo necessario para atender 5 ACs, sem over-engineering"
    },
    {
      "category": "glossary",
      "status": "pass",
      "evidence": "Slice de infraestrutura — sem termos de dominio introduzidos"
    },
    {
      "category": "adr_compliance",
      "status": "pass",
      "evidence": "Laravel 13, PHP ^8.4, PHPStan nivel 8, Pest 4, Pint preset laravel — conforme ADR-0001"
    },
    {
      "category": "dead_code",
      "status": "pass",
      "evidence": "src/Utils/Greeting.php e tests/Unit/GreetingTest.php (smoke test antigo) removidos corretamente"
    }
  ],
  "findings": [
    {
      "severity": "minor",
      "category": "simplicity",
      "file": "composer.json",
      "line": 18,
      "message": "PSR-4 entries App\\Domain\\ e App\\Infrastructure\\ sao redundantes com App\\ -> app/, mas explicitam intencao arquitetural conforme plan.md D2. Nao requer acao."
    }
  ],
  "next_action": "approve_pr"
}
