{
  "slice_id": "slice-006",
  "verdict": "approved",
  "timestamp": "2026-04-13T04:29:14Z",
  "quality_checks": [
    {
      "category": "duplication",
      "status": "pass",
      "evidence": "tests/slice-006/TestHelpers.php centraliza execucao de processos, requisicao /ping e validacoes de manifest usadas pelos testes do slice."
    },
    {
      "category": "complexity",
      "status": "pass",
      "evidence": "tests/slice-006/ac-006-livewire-commandTest.php simula ausencia via livewire.finder/livewire.factory e nao remove ping do proprio output; routes/console.php descobre componentes sem default fixo."
    },
    {
      "category": "naming",
      "status": "pass",
      "evidence": "Nomes novos no diff sao consistentes com o slice: App\\Livewire\\Ping, increment, /ping e helpers slice006_*."
    },
    {
      "category": "security",
      "status": "pass",
      "evidence": "routes/web.php registra /ping somente quando o ambiente nao e production; AC-SEC-001 cobre 404 e ausencia de diagnostico em production."
    },
    {
      "category": "simplicity",
      "status": "pass",
      "evidence": "A implementacao runtime fica limitada a um componente, uma view, um layout, uma rota condicional e um comando de listagem por descoberta."
    },
    {
      "category": "glossary",
      "status": "pass",
      "evidence": "O diff nao introduz termos de dominio conflitantes com o glossario; docs/explanations/slice-006.md usa linguagem de produto sem nomes de stack ou identificadores tecnicos."
    },
    {
      "category": "adr_compliance",
      "status": "pass",
      "evidence": "composer.json adiciona livewire/livewire ^4.0 e o slice usa Vite, Tailwind CSS e Livewire conforme ADR-0001."
    },
    {
      "category": "dead_code",
      "status": "pass",
      "evidence": "App\\Livewire\\Ping e resources/views/livewire/ping.blade.php sao conectados por routes/web.php; livewire:list e coberto pelos testes AC-005/AC-010."
    }
  ],
  "findings": [],
  "next_action": "approve_pr"
}
