{
  "slice_id": "slice-005",
  "verdict": "approved",
  "timestamp": "2026-04-13T01:09:03Z",
  "quality_checks": [
    {
      "category": "duplication",
      "status": "pass",
      "evidence": "Padrão try/catch para DB e Redis tem ~5 linhas cada — abaixo do limiar de 10 linhas. Setup de mock repetido nos testes é padrão normal em suítes unitárias (cada teste isolado). Sem copy-paste entre arquivos de produção."
    },
    {
      "category": "complexity",
      "status": "pass",
      "evidence": "HealthCheckController.php e HealthCheckRateLimit.php mantem responsabilidades pequenas, com nesting maximo de 2 niveis no controller e try/catch isolado no middleware. Testes continuam com funcoes simples e planas."
    },
    {
      "category": "naming",
      "status": "pass",
      "evidence": "Classes: HealthCheckController, HealthCheckRateLimit — PascalCase Laravel, verbo+substantivo descritivos. Variáveis: $db, $redis, $status, $httpCode, $ip, $key, $hits, $payload — todos descritivos sem abreviações obscuras. Constantes: MAX_REQUESTS, WINDOW_SECONDS, DETAIL_TRUSTED_IPS — claras e sem ambiguidade."
    },
    {
      "category": "security",
      "status": "pass",
      "evidence": "Sem SQL injection: query literal hardcoded 'SELECT 1' sem interpolação de input. Sem secrets hardcoded. Rate limit por IP usa o cache configurado por ambiente e captura falha do cache para manter o diagnostico do /health. Detalhes db/redis ficam restritos a IP local. Endpoint público sem auth é explicitamente fora de escopo no spec. Nenhum path traversal, XSS ou SSRF introduzido."
    },
    {
      "category": "simplicity",
      "status": "pass",
      "evidence": "1 controller invocável, 1 middleware dedicado, 1 linha de rota. Zero pacotes externos adicionados. Sem service layer, factory, strategy ou abstração prematura. Solução mínima que atende todos os 5 ACs."
    },
    {
      "category": "glossary",
      "status": "pass",
      "evidence": "Slice é infraestrutura técnica (healthcheck). Nenhum termo de domínio do glossário (OS, Técnico, Certificado, Instrumento, etc.) aparece no código — correto para este escopo. Nenhum alias proibido usado."
    },
    {
      "category": "adr_compliance",
      "status": "pass",
      "evidence": "ADR-0001 respeitado: Laravel 13 + PostgreSQL + Redis. Implementação usa DB facade, Redis facade e Cache store configurado por ambiente — todos nativos do Laravel 13. Nenhum pacote externo adicionado. Nenhuma decisão contradiz ADR-0001 nem ADR-0002."
    },
    {
      "category": "dead_code",
      "status": "pass",
      "evidence": "Imports em HealthCheckController.php (DB, Redis, JsonResponse, Request) todos usados. Imports em HealthCheckRateLimit.php (Cache, Closure, Request, Response) todos usados. registrar-plan-reviewer.bat e .claude/agents/plan-reviewer.md são artefatos de harness com função documentada. Nenhuma função órfã."
    }
  ],
  "findings": [],
  "next_action": "approve_pr"
}
