{
  "slice_id": "slice-900",
  "verdict": "approved",
  "timestamp": "2026-04-11T00:00:00Z",
  "quality_checks": [
    {
      "category": "duplication",
      "status": "pass",
      "evidence": "Nenhuma duplicação >10 linhas. Instanciação new Greeting() repetida em 3 testes é padrão Pest sem beforeEach — aceitável para suite trivial."
    },
    {
      "category": "complexity",
      "status": "pass",
      "evidence": "Greeting.php tem 15 linhas, 1 método, 1 nível de nesting (if simples). Ciclomática = 2."
    },
    {
      "category": "naming",
      "status": "pass",
      "evidence": "Classe Greeting, método greet(string $name): string, variável $greeting nos testes — todos descritivos, seguem PSR-12 e convenção verbo+substantivo."
    },
    {
      "category": "security",
      "status": "pass",
      "evidence": "Função pura sem I/O, sem SQL, sem XSS, sem secrets hardcoded. Interpolação {$name} é PHP nativo seguro. Nenhum vetor OWASP aplicável a função utilitária pura."
    },
    {
      "category": "simplicity",
      "status": "pass",
      "evidence": "Implementação mínima necessária para os ACs. Sem abstrações prematuras, sem dependências desnecessárias, sem flags booleanas. Solução mais simples possível."
    },
    {
      "category": "glossary",
      "status": "pass",
      "evidence": "Slice é smoke test sem termos de domínio Kalibrium. Nenhum alias ou termo não-canônico utilizado."
    },
    {
      "category": "adr_compliance",
      "status": "pass",
      "evidence": "plan.md documenta D1 (PHP puro para smoke) e D2 (Pest como runner) com justificativa. Alinhado com ADR-0001 que escolhe Pest como test runner do projeto real."
    },
    {
      "category": "dead_code",
      "status": "pass",
      "evidence": "Nenhum import não usado, nenhum código não alcançável. Todos os 3 testes exercitam código real."
    }
  ],
  "findings": [],
  "next_action": "approve_pr"
}
