{
  "slice_id": "slice-002",
  "verdict": "approved",
  "timestamp": "2026-04-12T14:00:00Z",
  "quality_checks": [
    {
      "category": "duplication",
      "status": "pass",
      "evidence": "Nenhuma duplicacao >10 linhas. Tres arquivos de teste cobrem ACs distintos com estrutura minima nao repetida entre si."
    },
    {
      "category": "complexity",
      "status": "pass",
      "evidence": "DbCheckCommand.php: 41 linhas, responsabilidade unica (verificar DB + Redis), nesting maximo 2 niveis. Migration RLS: 18 linhas, uma responsabilidade. Todos os arquivos abaixo de 50 linhas."
    },
    {
      "category": "naming",
      "status": "pass",
      "evidence": "DbCheckCommand (verbo+substantivo descritivo), create_sanity_check_table (migration clara), enable_rls_setup (migration descritiva), ConfigCacheTest/DatabaseConnectionTest/DbCheckCommandTest (nomes alinhados ao AC coberto)."
    },
    {
      "category": "security",
      "status": "pass",
      "evidence": "Sem SQL injection (DB::select usa query literal sem interpolacao de input). Sem secrets hardcoded em codigo de producao. phpunit.xml contem credenciais de teste locais (DB_USERNAME=postgres, DB_PASSWORD vazio) — padrao Laravel aceitavel para CI local, registrado como minor. REDIS_PASSWORD=null em .env.example e string literal, registrado como minor."
    },
    {
      "category": "simplicity",
      "status": "pass",
      "evidence": "Sem abstracoes prematuras. DbCheckCommand usa facades Laravel canonicas (DB, Redis). Migration RLS delega para arquivo SQL externo documentado — decisao justificada em D2 do plan.md. Sem flags booleanas desnecessarias."
    },
    {
      "category": "glossary",
      "status": "pass",
      "evidence": "Nenhum alias proibido encontrado no codigo. 'Tenant' aparece apenas em comentarios do plan/spec com termo canonico. 'OS' referenciado apenas como fora do escopo. Nenhuma violacao das regras de uso do glossary-domain.md."
    },
    {
      "category": "adr_compliance",
      "status": "pass",
      "evidence": "ADR-0001 aceita PostgreSQL 18 + Redis 8 como stack. Drivers pgsql/redis configurados corretamente. Escolha de Predis sobre phpredis documentada em plan.md D1 com justificativa de disponibilidade imediata e reversibilidade explicita. Sem contradicao com ADR-0001 ou ADR-0002."
    },
    {
      "category": "dead_code",
      "status": "pass",
      "evidence": "Sem imports nao usados, funcoes orfas ou codigo inalcancavel. Todos os metodos handle() e up()/down() das migrations sao acessados pelo runner do Laravel."
    }
  ],
  "findings": [
    {
      "severity": "major",
      "category": "simplicity",
      "file": "specs/002/plan.md",
      "line": 478,
      "message": "Versao do Predis declarada no plan.md ('predis/predis': '^2.0') diverge da versao efetivamente instalada no composer.json/composer.lock (^3.4, v3.4.2). Documento de plano desatualizado compromete reprodutibilidade: um implementer lendo o plan.md tentaria instalar ^2.0 e obteria versao diferente da lockada. Corrigir plan.md para refletir '^3.4'."
    },
    {
      "severity": "minor",
      "category": "security",
      "file": "phpunit.xml",
      "line": 327,
      "message": "Credenciais de teste hardcoded (DB_USERNAME=postgres, DB_PASSWORD vazio) no phpunit.xml. Padrao aceitavel para desenvolvimento local, mas em pipeline CI com PostgreSQL real essas credenciais ficam expostas no repositorio. Recomendado mover para .env.testing (gitignored) em slices futuros de CI/CD (ADR-0007)."
    },
    {
      "severity": "minor",
      "category": "security",
      "file": ".env.example",
      "line": 29,
      "message": "REDIS_PASSWORD=null e string literal 'null', nao valor vazio. Se copiado diretamente para .env, o Laravel tentara autenticar com a senha 'null' no Redis, causando falha de conexao em ambientes sem senha. Recomendado usar REDIS_PASSWORD= (vazio) ou comentario explicativo."
    },
    {
      "severity": "minor",
      "category": "simplicity",
      "file": "database/migrations/0001_01_02_000001_enable_rls_setup.php",
      "line": 9,
      "message": "file_get_contents(database_path('setup/enable-rls.sql')) nao verifica existencia do arquivo antes de chamar DB::unprepared(). Se o arquivo SQL nao existir no ambiente de deploy (ex.: deploy parcial, arquivo nao commitado), a migration falhara com PHP warning + erro de DB obscuro em vez de mensagem clara. Recomendado adicionar verificacao com excecao descritiva."
    }
  ],
  "next_action": "approve_pr"
}
